{
  "$schema": "https://json-schema.org/draft/2020-12/schema",
  "type": "object",
  "properties": {
    "businessDetailsUpToDate": {
      "type": "boolean",
      "const": true
    },
    "landRegisteredWithRpa": {
      "type": "boolean",
      "const": true
    },
    "landManagementControl": {
      "type": "boolean"
    },
    "publicBodyTenant": {
      "type": "boolean"
    },
    "landHasGrazingRights": {
      "type": "boolean"
    },
    "appLandHasExistingWmp": {
      "type": "boolean"
    },
    "intendToApplyHigherTier": {
      "type": "boolean"
    },
    "woodlandName": {
      "type": "string"
    },
    "hectaresTenOrOverYearsOld": {
      "type": "number",
      "minimum": 0.4
    },
    "hectaresUnderTenYearsOld": {
      "type": "number",
      "minimum": 0
    },
    "centreGridReference": {
      "type": "string"
    },
    "fcTeamCode": {
      "type": "string",
      "enum": [
        "EAST_AND_EAST_MIDLANDS",
        "NORTH_WEST_AND_WEST_MIDLANDS",
        "SOUTH_EAST_AND_LONDON",
        "SOUTH_WEST",
        "YORKSHIRE_AND_NORTH_EAST"
      ]
    },
    "applicant": {
      "type": "object",
      "properties": {
        "business": {
          "type": "object"
        },
        "customer": {
          "type": "object"
        }
      },
      "required": ["business", "customer"]
    },
    "detailsConfirmedAt": {
      "type": "string",
      "format": "date-time"
    },
    "totalHectaresForSelectedParcels": {
      "type": "number",
      "minimum": 0.5
    },
    "guidanceRead": {
      "type": "boolean",
      "const": true
    },
    "includedAllEligibleWoodland": {
      "type": "boolean"
    },
    "applicationConfirmation": {
      "type": "boolean",
      "const": true
    },
    "landParcels": {
      "type": "array",
      "items": {
        "type": "object",
        "properties": {
          "parcelId": {
            "type": "string"
          },
          "areaHa": {
            "type": "number",
            "exclusiveMinimum": 0
          }
        },
        "required": ["parcelId", "areaHa"]
      },
      "minItems": 1
    },
    "totalAgreementPaymentPence": {
      "type": "number",
      "exclusiveMinimum": 0
    },
    "payments": {
      "type": "object",
      "properties": {
        "agreement": {
          "type": "array",
          "items": {
            "type": "object",
            "properties": {
              "code": {
                "type": "string"
              },
              "description": {
                "type": "string"
              },
              "activePaymentTier": {
                "type": "number",
                "minimum": 0
              },
              "quantityInActiveTier": {
                "type": "number",
                "minimum": 0
              },
              "activeTierRatePence": {
                "type": "number",
                "minimum": 0
              },
              "activeTierFlatRatePence": {
                "type": "number",
                "minimum": 0
              },
              "quantity": {
                "type": "number",
                "minimum": 0
              },
              "agreementTotalPence": {
                "type": "number",
                "minimum": 0
              },
              "unit": {
                "type": "string",
                "enum": ["ha", "%"]
              }
            },
            "required": [
              "code",
              "description",
              "activePaymentTier",
              "quantityInActiveTier",
              "activeTierRatePence",
              "activeTierFlatRatePence",
              "quantity",
              "agreementTotalPence",
              "unit"
            ]
          }
        }
      }
    }
  },
  "required": [
    "businessDetailsUpToDate",
    "guidanceRead",
    "landRegisteredWithRpa",
    "landManagementControl",
    "publicBodyTenant",
    "landHasGrazingRights",
    "appLandHasExistingWmp",
    "intendToApplyHigherTier",
    "includedAllEligibleWoodland",
    "woodlandName",
    "totalHectaresForSelectedParcels",
    "hectaresTenOrOverYearsOld",
    "hectaresUnderTenYearsOld",
    "centreGridReference",
    "fcTeamCode",
    "applicationConfirmation",
    "landParcels"
  ]
}
